{"$schema":"https://json-schema.org/draft/2020-12/schema","$id":"https://kaveep.dev/dev-agent/schemas/standalone-session-result.schema.json","title":"KAVEEP Standalone Session Result","type":"object","required":["sessionResultId","schemaVersion","sessionRequestRef","status","state","events","artifacts","sandboxManifestRef","cleanupRequired","errors","warnings","startedAt","completedAt","recommendedNextAction"],"properties":{"sessionResultId":{"type":"string","pattern":"^standalone_session_result_[A-Za-z0-9][A-Za-z0-9_-]*$"},"schemaVersion":{"type":"string","const":"1.0.0"},"sessionRequestRef":{"type":"string","pattern":"^standalone_session_request_[A-Za-z0-9][A-Za-z0-9_-]*$"},"status":{"type":"string","enum":["awaiting_approval","no_action","blocked","failed"]},"state":{"type":"string","enum":["received","analyzing","sandbox_ready","engineering","validating","reviewing","awaiting_approval","no_action","blocked","failed"]},"events":{"type":"array","items":{"type":"object","required":["sequence","state","message","createdAt"],"properties":{"sequence":{"type":"integer","minimum":1},"state":{"type":"string"},"message":{"type":"string"},"createdAt":{"type":"string","format":"date-time"}},"additionalProperties":false}},"artifacts":{"type":"object"},"sandboxManifestRef":{"type":["string","null"]},"cleanupRequired":{"type":"boolean"},"errors":{"type":"array","items":{"type":"string"}},"warnings":{"type":"array","items":{"type":"string"}},"startedAt":{"type":"string","format":"date-time"},"completedAt":{"type":"string","format":"date-time"},"recommendedNextAction":{"type":"string","enum":["review_and_approve","cleanup_sandbox","start_container_runtime","gather_more_context","no_action","investigate_failure"]}},"additionalProperties":false}
