{"sessionResultId":"standalone_session_result_example_001","schemaVersion":"1.0.0","sessionRequestRef":"standalone_session_request_example_001","status":"awaiting_approval","state":"awaiting_approval","events":[{"sequence":1,"state":"analyzing","message":"เริ่มวิเคราะห์ repository","createdAt":"2026-07-11T00:00:00.000Z"}],"artifacts":{},"sandboxManifestRef":"C:/temp/sandbox-manifest.json","cleanupRequired":true,"errors":[],"warnings":[],"startedAt":"2026-07-11T00:00:00.000Z","completedAt":"2026-07-11T00:01:00.000Z","recommendedNextAction":"review_and_approve"}
